{
  "$schema": "./schema/locale.schema.json",
  "language": "zh-Hans",
  "displayName": "简体中文",
  "rightToLeft": false,
  "strings": {
    "app": {
      "name": "MetalForge",
      "loading": "正在加载配置…",
      "ready": "就绪",
      "busy": "处理中…"
    },
    "menu": {
      "file": {
        "title": "文件",
        "items": {
          "newProject": "新建项目…",
          "openProject": "打开项目…",
          "closeProject": "关闭项目",
          "recent": "最近打开",
          "save": "保存",
          "saveAll": "全部保存",
          "exit": "退出"
        }
      },
      "edit": {
        "title": "编辑",
        "items": {
          "undo": "撤销",
          "redo": "重做",
          "cut": "剪切",
          "copy": "复制",
          "paste": "粘贴",
          "find": "查找",
          "replace": "替换",
          "formatDocument": "格式化文档"
        }
      },
      "view": {
        "title": "视图",
        "items": {
          "explorer": "项目浏览器",
          "inspector": "属性面板",
          "output": "输出面板",
          "terminal": "终端",
          "layout": "布局预设",
          "theme": "配色主题",
          "language": "界面语言",
          "resetLayout": "重置布局"
        }
      },
      "build": {
        "title": "构建",
        "items": {
          "build": "构建",
          "rebuild": "重新构建",
          "clean": "清理",
          "cleanOutputs": "清理产物",
          "cleanAll": "清理全部（含中间文件）",
          "configuration": "构建配置"
        }
      },
      "run": {
        "title": "运行",
        "items": {
          "start": "启动 QEMU",
          "stop": "停止",
          "debugStart": "启动调试",
          "restart": "重新启动"
        }
      },
      "tools": {
        "title": "工具",
        "items": {
          "toolchainHealth": "工具链健康检查",
          "refreshDetection": "重新探测工具链",
          "commandPalette": "命令面板…"
        }
      },
      "help": {
        "title": "帮助",
        "items": {
          "documentation": "文档",
          "changelog": "更新日志",
          "about": "关于 MetalForge"
        }
      }
    },
    "toolbar": {
      "groupProject": "项目",
      "groupBuild": "构建",
      "groupRun": "运行",
      "groupDebug": "调试",
      "groupView": "视图",
      "notImplemented": "该功能在后续里程碑实现",
      "menuBar": "菜单栏"
    },
    "panel": {
      "explorer": "项目",
      "inspector": "属性",
      "bottom": "输出",
      "bottomLeft": "控制台",
      "bottomCenter": "串口",
      "bottomRight": "监视器"
    },
    "tab": {
      "welcome": "欢迎",
      "projectFiles": "文件",
      "projectTemplates": "模板",
      "projectSymbols": "符号",
      "inspectorProperties": "属性",
      "inspectorArtifact": "产物信息",
      "inspectorLayoutMap": "链接布局",
      "outputBuild": "构建输出",
      "outputProblems": "问题",
      "terminalShell": "终端",
      "terminalSerial": "串口",
      "debugConsole": "调试控制台",
      "debugMonitor": "QEMU 监视器",
      "debugStack": "调用栈",
      "debugVariables": "变量",
      "debugRegisters": "寄存器",
      "debugBreakpoints": "断点",
      "debugMemory": "内存",
      "aiAgent": "AI 助手",
      "toolchainHealth": "工具链",
      "about": "关于",
      "settings": "设置",
      "editor": "编辑器"
    },
    "status": {
      "arch": "架构",
      "bootMethod": "引导",
      "configuration": "配置",
      "toolchain": "工具链",
      "buildState": "构建",
      "cursor": "光标",
      "problems": "问题",
      "debugState": "调试",
      "currentFrame": "栈帧",
      "noProject": "未打开项目",
      "toolchainReady": "工具链就绪",
      "toolchainDegraded": "工具链不完整",
      "toolchainMissing": "缺少工具链",
      "buildIdle": "未构建",
      "buildSucceeded": "构建成功",
      "buildFailed": "构建失败",
      "errorsOnly": "{0} 个错误",
      "errorsAndWarnings": "{0} 个错误，{1} 个警告",
      "noProblems": "无问题"
    },
    "welcome": {
      "nextSteps": "接下来可以做什么",
      "stepNewProject": "新建一个项目：文件 → 新建项目…",
      "stepOpenProject": "打开已有项目：文件 → 打开项目…",
      "stepToolchain": "检查工具链是否齐全：工具 → 工具链健康检查",
      "stepDocs": "阅读设计与使用文档：帮助 → 文档",
      "configHint": "提示：编辑 assets/branding/app.json 或 assets/themes/*.theme.json 后保存，界面会立即更新。",
      "configOk": "配置已加载：{0} 套主题，全部通过 Schema 校验。",
      "configProblems": "配置有 {0} 处需要注意，第一条：{1}"
    },
    "about": {
      "creditsTitle": "技术致谢",
      "linksTitle": "相关链接",
      "noDiagnostics": "配置无异常。"
    },
    "placeholder": {
      "message": "该标签页尚未实现。它的归属里程碑见下方标记："
    },
    "explorer": {
      "empty": "尚未打开项目",
      "emptyHint": "使用「文件 → 新建项目…」创建第一个 OSDev 项目",
      "refresh": "刷新",
      "revealInExplorer": "在资源管理器中显示",
      "copyPath": "复制路径"
    },
    "inspector": {
      "noSelection": "未选中任何对象",
      "noSelectionHint": "在项目浏览器中选择文件，或在编辑器中选中代码"
    },
    "output": {
      "clear": "清空",
      "copyAll": "复制全部",
      "exportLog": "导出日志",
      "empty": "暂无输出",
      "wrapLines": "自动换行",
      "followTail": "跟随末尾"
    },
    "problems": {
      "empty": "暂无问题",
      "severity": "级别",
      "code": "代码",
      "description": "说明",
      "location": "位置",
      "severityError": "错误",
      "severityWarning": "警告",
      "severityInfo": "信息"
    },
    "terminal": {
      "serialTitle": "串口输出",
      "disconnected": "未连接",
      "waitingForOutput": "等待串口输出…",
      "clearBuffer": "清空缓冲",
      "saveBuffer": "保存到文件",
      "baudRate": "波特率",
      "sendInput": "发送内容",
      "send": "发送"
    },
    "toolchain": {
      "title": "工具链健康检查",
      "subtitle": "MetalForge 通过命令行调用外部工具；这里是当前探测结果。",
      "statusReady": "全部就绪",
      "statusDegraded": "部分缺失",
      "statusMissing": "未检测到工具链",
      "columnTool": "工具",
      "columnPurpose": "用途",
      "columnStatus": "状态",
      "columnVersion": "版本",
      "columnSource": "来源",
      "found": "已找到",
      "missing": "未找到",
      "outdated": "版本过低",
      "required": "要求 {version} 或更高",
      "expectedIn": "常见位置：{paths}",
      "howToGet": "获取方式",
      "refresh": "重新探测",
      "refreshing": "正在探测…",
      "lastChecked": "上次探测：{time}",
      "sourceProjectConfig": "项目配置",
      "sourceUserConfig": "用户配置",
      "sourceManaged": "MetalForge 托管目录",
      "sourcePath": "系统 PATH",
      "sourceKnownLocation": "常见安装位置",
      "categoryBuild": "构建工具",
      "categoryToolchain": "编译器与工具链",
      "categoryEmulator": "模拟器",
      "categoryDebugger": "调试器",
      "categoryFlash": "烧录工具",
      "categoryLanguage": "语言服务",
      "categoryGeneral": "其他",
      "missingSectionTitle": "还缺少这些必需工具",
      "explainTitle": "为什么需要这些工具",
      "explainBody": "MetalForge 不随附编译器、模拟器与烧录工具，也不修改系统 PATH。它只负责探测、校验与调用；缺失时给出获取指引。"
    },
    "dialog": {
      "ok": "确定",
      "cancel": "取消",
      "close": "关闭",
      "apply": "应用",
      "reset": "重置",
      "copy": "复制",
      "copied": "已复制",
      "error": "错误",
      "warning": "警告",
      "info": "提示"
    },
    "settings": {
      "title": "设置",
      "editor": "编辑器",
      "build": "构建",
      "run": "运行",
      "appearance": "外观",
      "shortcuts": "快捷键",
      "toolchain": "工具链",
      "ai": "AI 助手",
      "language": "界面语言",
      "theme": "配色主题",
      "layout": "布局预设",
      "density": "界面密度"
    }
  }
}
